{
  "version": "1.0",
  "timestamp": "2026-09-01T10:00:00Z",
  "generated_at": "2026-09-01T10:00:00Z",
  "task_id": "task-123",
  "checkpoint_ref": "a1b2c3d",
  "executor": "cc-ds4",
  "executor_id": "cc-ds4",
  "review_round": 1,
  "reviewers_total": 3,
  "reviewers_responded": 3,
  "reviewers_accounted": 3,
  "votes": [
    { "reviewer": "codex", "vote": "YES_APPROVE", "weight": 2, "source": "manifest", "confidence": 0.95, "issues_count": 0 },
    { "reviewer": "kimi",  "vote": "YES_APPROVE", "weight": 1, "source": "manifest", "confidence": 0.90, "issues_count": 0 },
    { "reviewer": "gemini", "vote": "NO_APPROVE", "weight": 1, "source": "manifest", "confidence": 0.85, "issues_count": 1 }
  ],
  "policy_snapshot": {
    "rule": "weighted_2/3_v1",
    "configured_seats": 3,
    "configured_weight": 4,
    "seat_quorum_required": 2,
    "weight_quorum_required": 3,
    "decision_threshold_numerator": 2,
    "decision_threshold_denominator": 3,
    "minimum_winning_seats": 2,
    "max_single_weight_share_numerator": 2,
    "max_single_weight_share_denominator": 3
  },
  "consensus_rule": "weighted_2/3_v1",
  "vote_breakdown": {
    "approve": 2,
    "reject": 1,
    "abstain": 0,
    "effective_seats": 3,
    "effective_weight": 4,
    "approve_seats": 2,
    "approve_weight": 3,
    "reject_seats": 1,
    "reject_weight": 1,
    "abstain_seats": 0,
    "abstain_weight": 0
  },
  "input_artifacts": [
    { "reviewer": "codex", "kind": "review_manifest", "path": ".macao/.reviews/codex.review.yml", "sha256": "e3b0c44298fc1c149afbf4c8996fb92427ae41e4649b934ca495991b7852b855", "evidence_commit": "a1b2c3d" },
    { "reviewer": "kimi", "kind": "review_manifest", "path": ".macao/.reviews/kimi.review.yml", "sha256": "e3b0c44298fc1c149afbf4c8996fb92427ae41e4649b934ca495991b7852b855", "evidence_commit": "a1b2c3d" },
    { "reviewer": "gemini", "kind": "review_manifest", "path": ".macao/.reviews/gemini.review.yml", "sha256": "e3b0c44298fc1c149afbf4c8996fb92427ae41e4649b934ca495991b7852b855", "evidence_commit": "a1b2c3d" }
  ],
  "issues_index": [
    {
      "issue_id": "gemini/ISSUE-01",
      "reviewer": "gemini",
      "disposition_class": "ADVISORY",
      "severity": "minor",
      "title": "Consider adding docstring for connection timeout parameter"
    }
  ],
  "issues_index_sha256": "3a7b1c4e9f0d2a8b5c6e7f1a2b3c4d5e6f7a8b9c0d1e2f3a4b5c6d7e8f9a0b1c",
  "requires_disposition": true,
  "decision": "APPROVED",
  "resolution": "AUTO_WEIGHTED_CONSENSUS"
}
